{
  "totalCaracteres": 13719,
  "cartoes": {
    "numeros": [
      "0342******9766",
      "0342******8752",
      "0342******9766",
      "0342******8752"
    ],
    "possiveisPortadores": [
      "ANDRE DA CRUZ DE SOUZA",
      "ANDRE CRUZ SOUZA",
      "LUANA COSTA L CRUZ",
      "PAGAMENTO MULTIBANCO",
      "AMAZON RC1SR9YK4",
      "PEDRO MIGUEL MACEDO",
      "REST NINKI",
      "MOREIA MAIA",
      "WORTEN MAIA VIVACI",
      "LM CINEMAS NORTE"
    ]
  },
  "parcelamentos": {
    "prestTopo": [
      "prestações fixas mensais, até 36 meses, e com uma taxa de juro mais reduzida.",
      "prestação acresce ao",
      "prestações",
      "prestações (*)",
      "prestações que afeta o Limite de Crédito disponível",
      "PREST. 11 - PAG. A PREST. REF.ª 00122905",
      "PREST. 09 - PAG. A PREST. REF.ª 00133092",
      "PREST. 05 - PAG. A PREST. REF.ª 00148696",
      "PREST. 02 - PAG. A PREST. REF.ª 00164300",
      "prestações",
      "Prestações Ref.ª: 00122905",
      "prestação:",
      "Prestação",
      "prestação: 162,36",
      "Prestação",
      "Prestações Ref.: 00133092",
      "prestação:",
      "Prestação",
      "prestação: 129,61",
      "Prestações Ref.ª: 00148696",
      "prestação:",
      "Prestação",
      "Prestação",
      "Prestação",
      "prestação: 186,15",
      "Prestações Ref.ª: 00164300",
      "prestação:",
      "Prestação",
      "Prestação",
      "prestação: 2.687,76"
    ],
    "referencias": [
      {
        "texto": "REF.ª 00122905",
        "numero": "00122905"
      },
      {
        "texto": "REF.ª 00133092",
        "numero": "00133092"
      },
      {
        "texto": "REF.ª 00148696",
        "numero": "00148696"
      },
      {
        "texto": "REF.ª 00164300",
        "numero": "00164300"
      },
      {
        "texto": "Ref.ª: 00122905",
        "numero": "00122905"
      },
      {
        "texto": "Ref.: 00133092",
        "numero": "00133092"
      },
      {
        "texto": "Ref.ª: 00148696",
        "numero": "00148696"
      },
      {
        "texto": "Ref.ª: 00164300",
        "numero": "00164300"
      }
    ],
    "detalhes": [
      {
        "ref": "00133092",
        "bloco": "Pag. a Prestações Ref.ª: 00122905\nTransação: IKEA MATOSINHOS LINHA DE MATOSINHOS\nData Transação: 10.09.2024\nValor: 922,55\nData Fracionamento: 13.09.2024\nTAN: 9,9000 %\nDetalhe da prestação:\nData do Débito\n08.08.2025\nN.º Prestação\nCapital a\nAmortizar\nJuros\nImpostos\n11/12\n80,82\n1,34\n0,05\nCapital em dívida após pagamento da prestação: 162,36\nTotal Prestação\n82,21\nNovo Banco, S.A., com sede no Campus do novobanco, Avenida Doutor Mário Soares,\nTaguspark, Edifício 1, 2740-119 Porto Salvo, Portugal, com"
      }
    ]
  },
  "limites": [
    "limite de crédito disponível do seu cartão de crédito para a conta à ordem associada,",
    "limite de crédito disponível,",
    "Limite: 28",
    "Limite de Crédito Saldo em dívida à data do extrato atual Saldo Pagamentos a prestações (*) Limite de Crédito disponível à data de fecho de extrato (*) Saldo de Pagamentos a prestações que afeta o Limite de Crédito disponível Limite de crédito e cartões associados Limite de Crédito da Conta-Cartão: 7.500,00",
    "Limite do cartão (*) TAN 14,000",
    "limite de utilização do(s) cartão (ões),",
    "limite de crédito disponível da conta-cartão em cada momento."
  ],
  "textoCompleto": "SAEPK173C\nProcessado por Computador DE - Digital Email\nnovobanco\nExtrato de Conta-Cartão\nCartão de Crédito: GOLD 360\nN.º de Conta-Cartão/Contrato: 1693062\nExtrato n.º 20\nMoeda: Euro\nData extrato atual: 08.08.2025\nData extrato anterior: 08.07.2025\nPara qualquer questão, por favor contacte\nLinha Direta - 707 300 360\n(Horário de atendimento personalizado das\n8h00 às 22h00 dias úteis e das 9h00 às 18h00\nfins de semana e feriados)\nMensagens\nYYYYYWHHHH|||WYNWYM\nANDRE DA CRUZ DE SOUZA\nR DO BAIRRO, 194\n3 ESQUERDO\nΜΑΙΑ\n4475-112 MAIA\nOs cartões de crédito do novobanco têm inúmeras vantagens para facilitar a gestão do dia-a-dia e do\nseu orçamento familiar, das quais destacamos:\n.\n• Adiantamento de Numerário a Crédito (Cash Advance): teve uma despesa inesperada e precisa de ter\ndinheiro na mão? Precisa de dinheiro na Conta à Ordem?\nFaça um levantamento a crédito numa ATM ou transfira o limite de crédito disponível do seu cartão de\ncrédito para a conta à ordem associada, no novobanco Online, na App ou na Linha Direta. O valor fica\nimediatamente disponível na sua conta.\nSem aprovações, preocupações e no imediato.\n• Pagamentos Parcelados: pague as suas compras ou o seu Cash Advance, desde que superiores a 75€,\nem prestações fixas mensais, até 36 meses, e com uma taxa de juro mais reduzida.\nPara tal, basta selecionar essa compra ou o Cash Advance até à data de fecho de extrato, no novobanco\nOnline, na App ou na Linha Direta.\nComo funciona?\nNB_M150810M03XXG4M_NOR_XXXXXSDX.005XX 193 1\n•\n•\nPara cada compra ou Cash Advance selecionados corresponde um plano de pagamento\nNa mesma conta-cartão pode ter até 10 pagamentos parcelados a decorrer em simultâneo\nO valor do pagamento parcelar afeta o limite de crédito disponível, cuja prestação acresce ao\nmontante a pagar em cada ciclo de extrato\nInformação para o pagamento de extrato\nForma de pagamento acordada:\nDébito na Conta D.O. Nº 0006 8211 5835\nOpção de pagamento acordada: 100% (1)\nMontante a pagar: 4.215,30 €\nData de pagamento: A partir do dia 28/08/2025\n(1) O valor a pagar corresponde à totalidade do saldo utilizado.\nPara pagar um montante diferente:\nUtilize a opção \"Pagamento de Serviços\" disponível no\nnovobanco Online e nos ATM da rede nacional\nMultibanco.\nEntidade: 20834\nRef.: 169 306 279\nMontante Mínimo a Pagar: 494,63 €\nData Limite: 28/08/2025 (Até às 18h00)\nMB\nMULTIBANCO\nSe o montante pago for inferior ao Montante Mínimo a Pagar a ordem de\ndébito será acionada pela diferença face ao valor do Montante Mínimo a\nPagar, sendo devida a Comissão de Recuperação de Valores em Dívida,\ncaso a conta de depósitos não apresente saldo suficiente para liquidação\ndesse montante. A falta de pagamento do valor correspondente, pelo\nmenos, ao Montante Mínimo a Pagar implica a cobrança de juros\nmoratórios nos termos previstos no Contrato.\nNovo Banco, S.A., com sede no Campus do novobanco, Avenida Doutor Mário Soares,\nTaguspark, Edifício 1, 2740-119 Porto Salvo, Portugal, com o número único 513 204 016 de\npessoa coletiva e de registo na Conservatória do Registo Comercial de Lisboa, com o\ncapital social de 2.245.000.000,00 euros Swift Address BESCPTPL.\nLinha Direta | 218 837 700. 707 247 365 | www.novobanco.pt\nAtendimento personalizado das 8h00 às 22h00, dias úteis, e das 9h00 às 18h00, fins\nde semana e feriados.\nExtrato de conta-cartão nº 20\npágina 1/6\nSAEPK173C\nProcessado por Computador DE - Digital Email\nNB_M150810M03XXG4M_NOR_XXXXXSDX.005XX 193 1\nResumo dos movimentos (consulte o detalhe nas páginas seguintes)\nSaldo em dívida à data do extrato anterior\nTotal de Créditos neste extrato\nTotal de Débitos neste extrato\nPagamentos a prestações\nAutorizações pendentes\nSaldo em dívida à data do extrato atual\nLimite de Crédito\nSaldo em dívida à data do extrato atual\nSaldo Pagamentos a prestações (*)\nLimite de Crédito disponível à data de fecho de extrato\n(*) Saldo de Pagamentos a prestações que afeta o Limite de Crédito disponível\nLimite de crédito e cartões associados\nLimite de Crédito da Conta-Cartão: 7.500,00€\n2.317,85 €\n2.451,39 €\n4.050,03 €\n298,81 €\n44,40 €\n4.215,30 €\n7.500,00 €\n4.215,30 €\n2.894,23 €\n346,07 €\nN.º cartão\nCartão\nNome\nANDRE CRUZ SOUZA\nLUANA COSTA L CRUZ\n460342******9766 GOLD 360\n460342******8752 GOLD 360\nData\nValidade\n01/2029\n01/2029\nLimite do cartão (*)\nTAN\n14,000%\n14,000%\n(*) O limite de utilização do(s) cartão (ões), mesmo que pré-definido, está condicionado adicionalmente ao limite de crédito disponível da conta-cartão em cada momento.\nDetalhe dos movimentos\nData dos movimentos: de 08.07.2025 até 08.08.2025\nData da\ntransação\nData do\nprocessamento\nDescritivo\nMoeda: Euro\nDébito\nCrédito\n2.317,85\n09.07.2025\n09.07.2025\nSaldo em dívida à data do extrato anterior\nPAGAMENTO MULTIBANCO\n2.317,85\nCartão n.º 460342******9766\n24.07.2025\n08.08.2025\n08.08.2025\n08.08.2025\n08.08.2025\n25.07.2025\n08.08.2025\n08.08.2025\n08.08.2025\n08.08.2025\nBCM-BRICOLAGE, SA\nΜΑΙΑ\n24,91\nPREST. 11 - PAG. A PREST. REF.ª 00122905\nPREST. 09 - PAG. A PREST. REF.ª 00133092\nPREST. 05 - PAG. A PREST. REF.ª 00148696\nPREST. 02 - PAG. A PREST. REF.ª 00164300\n82,21\n33,10\n94,27\n89,23\nSub-total\n298,81\n24,91\nTransações rede VISA\n09.07.2025\n09.07.2025\n10.07.2025\n13.07.2025\n16.07.2025\n10.07.2025\n11.07.2025\n11.07.2025\n14.07.2025\n17.07.2025\nAmazon Prime RC3FJ72Z4\nAMAZON RC1SR9YK4\namazon.es/prm\n4,99\nLUXEMBOURG\n9,68\nAMZN Mktp ES RC64D5YX4\nPEDRO MIGUEL MACEDO\nAPPLE.COM/BILL\n800-279-6620\n27,34\nΜΑΙΑ\nITUNES.COM\n8,00\n9,99\n17.07.2025\n20.07.2025\n18.07.2025\nREST NINKI\nMATOSINHOS\n51,90\n20.07.2025\n21.07.2025\n21.07.2025\n2621 TEDI ESTRADA REAL\nMOREIA MAIA\n80,35\nWORTEN MAIA VIVACI\nΜΑΙΑ\n89,99\nExtrato de conta-cartão nº 20\npágina 2/6\nSAEPK173C\nProcessado por Computador DE - Digital Email\nNB_M150810M03XXG4M_NOR_XXXXXSDX.005XX 193 2\nnovobanco\nDetalhe dos movimentos\nData dos movimentos: de 08.07.2025 até 08.08.2025\nMoeda: Euro\nData da\ntransação\nData do\nprocessamento\nDescritivo\nDébito\nCrédito\n21.07.2025\n23.07.2025\n25.07.2025\n26.07.2025\n22.07.2025\n25.07.2025\n26.07.2025\n26.07.2025\nBCM-BRICOLAGE, SA\nLM CINEMAS NORTE\nΜΑΙΑ\n84,63\nSENHORA DA HO\n37,60\nKLARNA ABOUT YOU\nSTOCKHOLM\n75,00\nDecathlon Aluguer\nAmadora\n6,00\n26.07.2025\n27.07.2025\nKlarna ABOUT YOU\nStockholm\n58,34\n01.08.2025\n02.08.2025\nAPPLE.COM/BILL\nITUNES.COM\n7,49\n01.08.2025\n02.08.2025\nAPPLE.COM/BILL\nITUNES.COM\n7,99\n01.08.2025\n02.08.2025\n04.08.2025\n04.08.2025\n03.08.2025\n03.08.2025\nAUCHAN MAIA\nMAIA\n5,78\nMDSTAR, UNIPESSOAL LD\nCANIDELO\n24,10\n06.08.2025\n05.08.2025\n05.08.2025\n07.08.2025\nGILBERTO A F CARDOSO\nMOREIRA DE CO\n6,50\nKLARNA AB\nWWW.KLARNA.CO\n14,30\nAPPLE.COM/BILL\nITUNES.COM\n1,99\n06.08.2025\n07.08.2025\nAPPLE.COM/BILL\nITUNES.COM\n9,99\n06.08.2025\n07.08.2025\nYUPI COLOR FUN PARK\nMAIA\n15,00\nSub-total\n636,95\n0,00\nTotal do Cartão\n935,76\n24,91\nCartão n.º 460342******8752\n10.07.2025\n11.07.2025\nshein.com\nshein.com\n1,11\n10.07.2025\n11.07.2025\nshein.com\nshein.com\n21,52\n10.07.2025\n11.07.2025\nshein.com\nshein.com\n21,52\n11.07.2025\n12.07.2025 shein.com\nshein.com\n11,02\n14.07.2025\n15.07.2025 Pluricosmetica.com\nINTERNET\n16,66\n16.07.2025\n17.07.2025\naliexpress\nLuxembourg\n12,35\n27.07.2025\n28.07.2025\n31.07.2025\n31.07.2025\n01.08.2025\n28.07.2025\n29.07.2025\n01.08.2025\n01.08.2025\nTEMU.COM\nWWW.TEMU.COM\n37,78\nCONTINENTE MAIA JARD\nΜΑΙΑ\n26,00\nZumub\nINTERNET\n14,16\nABOUT YOU SE Co. KG\nHamburg\n43,11\n02.08.2025\nshein.com\nshein.com\n11,48\n01.08.2025\n02.08.2025\nSentimental Journey\nLisboa\n11,69\n02.08.2025\n04.08.2025\n03.08.2025\n05.08.2025\nshein.com\nshein.com\n19,25\nshein.com\nshein.com\n36,06\nSub-total\n235,08\n48,63\nTransações rede VISA\n10.07.2025\n11.07.2025\nPROMOSTOCK\n10.07.2025\n11.07.2025\nRECHEIO-RAMALDE\nGONDOMAR\nPORTO\n10,00\n257,72\nNovo Banco, S.A., com sede no Campus do novobanco, Avenida Doutor Mário Soares,\nTaguspark, Edifício 1, 2740-119 Porto Salvo, Portugal, com o número único 513 204 016 de\npessoa coletiva e de registo na Conservatória do Registo Comercial de Lisboa, com o\ncapital social de 2.245.000.000,00 euros Swift Address BESCPTPL.\nLinha Direta | 218 837 700. 707 247 365 | www.novobanco.pt\nAtendimento personalizado das 8h00 às 22h00, dias úteis, e das 9h00 às 18h00, fins\nde semana e feriados.\nExtrato de conta-cartão nº 20\npágina 3/6\nNB_M150810M03XXG4M_NOR_XXXXXSDX.005XX 193 2\nDetalhe dos movimentos\nData dos movimentos: de 08.07.2025 até 08.08.2025\nMoeda: Euro\nData da\ntransação\nData do\nDescritivo\nDébito\nCrédito\nprocessamento\n11.07.2025\n11.07.2025\n12.07.2025 CONTINENTE CANIDELO\n12.07.2025\nVILA NOVA DE\n16,92\nCONTINENTE CANIDELO\n11.07.2025\n12.07.2025 Action 1408\nVILA NOVA DE\nVila Nova de\n87,05\n97,52\n13.07.2025\n13.07.2025\n16.07.2025\n16.07.2025\n14.07.2025\n14.07.2025\n17.07.2025\nOLA PARQUE CIDADE\nXU SHICHAO, UNIPESSO\nPORTO\n3,20\nV N GAIA\n100,30\n17.07.2025\nHOSPITAL DIA DA MAIA\nFarmacia do Castelo\nMAIA\n30,00\nΜΑΙΑ\n37,11\n18.07.2025\n19.07.2025\nCONTINENTE MODELO\nMAIA\n15,98\n19.07.2025\n20.07.2025\nENTRECOTE\nBRAGA\n117,20\n20.07.2025\n21.07.2025\n21.07.2025\n21.07.2025\n21.07.2025\n21.07.2025\n21.07.2025\n22.07.2025\n22.07.2025\n22.07.2025\nMAIA VIVACI\nΜΑΙΑ\n34,81\nMAXMAT MAIA\nNOVA, BARCA - MAIA\n17,20\nMERCADONA\nΜΑΙΑ\n61,88\nIKEA MATOSINHOS LINHA DE MATOSINHOS\n117,90\nCONTINENTE MAIA JARD\nΜΑΙΑ\n239,57\n22.07.2025\n23.07.2025\n2652 TEDI MAIA\nΜΑΙΑ\n3,00\n22.07.2025\n23.07.2025\nAUCHAN MAIA\nMAIA\n12,67\n22.07.2025\n23.07.2025\nPINGO DOCE CASTELO D\nOEIRAS\n26,99\n22.07.2025\n23.07.2025\nPRIMARK PORTO NORTE SHOPPPORTO\n29,20\n22.07.2025\n23.07.2025\nLEFTIES NORTESHOP\nSENHORA DA HO\n43,97\n25.07.2025\n28.07.2025\n28.07.2025\n28.07.2025\n28.07.2025\n28.07.2025\n28.07.2025\n28.07.2025\n27.07.2025\n29.07.2025\n29.07.2025\n29.07.2025\n29.07.2025\n29.07.2025\n29.07.2025\n29.07.2025\nAUCHAN MAIA\nMAIA\n14,99\nUCI ARRABIDA\nVILA NOVA DE\n2,60\nUCI ARRABIDA\nVILA NOVA DE\n6,20\nMCDONALD'S\nV N GAIA\n6,70\nUCI ARRABIDA\nVILA NOVA DE\n9,00\nPEPCO 280023 VILA NOVA DEVILA NOVA DE\n9,00\nAUCHAN GAIA\nVILA NOVA DE\n12,99\nMERCADONA\nMAIA\n30,13\n28.07.2025\n29.07.2025\nCONTINENTE MAIA JARD\nMAIA\n111,96\n29.07.2025\n31.07.2025\n02.08.2025\n30.07.2025\n01.08.2025\nMERCADONA\nMAIA\n10,70\nJONY WILSON, LDA\nMAIA\n35,00\n03.08.2025\nFarmacia do Castelo\nΜΑΙΑ\n4,21\n02.08.2025\n03.08.2025\n03.08.2025\nMDSTAR, UNIPESSOAL LD\nCANIDELO\n5,10\n04.08.2025\n04.08.2025\n04.08.2025\n05.08.2025\n03.08.2025\n05.08.2025\n05.08.2025\n05.08.2025\n06.08.2025\nAUCHAN ENERGY SA MAIMAIA\n60,01\nTEMPO LIVRE\nGUIMARAES\n6,00\nFOTOSOUVENIR CAST PE\nCASTANHEIRA D\n12,00\nRESTAURANT MULTIUSOS\nGUIMARAES\n17,00\nMERCADONA\nMAIA\n20,65\nSAEPK173C\nProcessado por Computador DE - Digital Email\nExtrato de conta-cartão nº 20\npágina 4/6\nSAEPK173C\nProcessado por Computador DE - Digital Email\nNB_M150810M03XXG4M_NOR_XXXXXSDX.005XX 193 3\nnovobanco\nDetalhe dos movimentos\nData dos movimentos: de 08.07.2025 até 08.08.2025\nData da\ntransação\nData do\nprocessamento\n06.08.2025\n07.08.2025\nAPPLE.COM/BILL\n06.08.2025\n07.08.2025\nCONTINENTE MAIA JARD\n07.08.2025\n07.08.2025\n08.08.2025\n08.08.2025\nQUIOSQUE PARQUEPARQU\nQUIOSQUE PARQUEPARQU\nMoeda: Euro\nDescritivo\nDébito\nCrédito\nITUNES.COM\nMAIA\n1,99\n209,71\nOLIVEIRA DO D\nOLIVEIRA DO D\n6,00\n6,10\nSub-total\n1.958,23\n0,00\nTransações rede MULTIBANCO\n09.07.2025\n11.07.2025\n15.07.2025\n15.07.2025\n15.07.2025\n22.07.2025\n10.07.2025\n11.07.2025\n15.07.2025\n15.07.2025\n15.07.2025\n22.07.2025\nAGRA CLUB\nΜΑΙΑ\nASS DANCA SAMUEL FERLEA BALIO\nAUCHAN ENERGY SA MAIMAIA\nAUCHAN ENERGY SA MAIMAIA\nAUCHAN ENERGY SA MAIMAIA\nAUCHAN MAIA\nMAIA\n24.07.2025\n27.07.2025\n27.07.2025\n24.07.2025\nAUCHAN ENERGY SA MAIMAIA\n27.07.2025\nLEROY MERLIN MAIA\n4470-439 MAIA\n27.07.2025\nMERCADONA\nMAIA\n30.07.2025\n04.08.2025\n30.07.2025\nFARMACIA DO CASTELO 4475-615 MAIA\n04.08.2025\nPINGO DOCE CASTELO DMAIA\n08.08.2025\n08.08.2025\nPINGO DOCE CASTELO DMAIA\n6,00\n25,00\n60,00\n60,00\n60,00\n28,54\n59,99\n9,16\n16,95\n854,51\n78,66\n20,96\nSub-total\n1.219,77\n60,00\nTotal do Cartão\n3.413,08\n108,63\nTotal de movimentos do mês\n4.348,84\n2.451,39\nSaldo em dívida à data do extrato atual\n4.215,30\nPagamento a prestações\nPag. a Prestações Ref.ª: 00122905\nTransação: IKEA MATOSINHOS LINHA DE MATOSINHOS\nData Transação: 10.09.2024\nValor: 922,55\nData Fracionamento: 13.09.2024\nTAN: 9,9000 %\nDetalhe da prestação:\nData do Débito\n08.08.2025\nN.º Prestação\nCapital a\nAmortizar\nJuros\nImpostos\n11/12\n80,82\n1,34\n0,05\nCapital em dívida após pagamento da prestação: 162,36\nTotal Prestação\n82,21\nNovo Banco, S.A., com sede no Campus do novobanco, Avenida Doutor Mário Soares,\nTaguspark, Edifício 1, 2740-119 Porto Salvo, Portugal, com o número único 513 204 016 de\npessoa coletiva e de registo na Conservatória do Registo Comercial de Lisboa, com o\ncapital social de 2.245.000.000,00 euros Swift Address BESCPTPL.\nLinha Direta | 218 837 700. 707 247 365 | www.novobanco.pt\nAtendimento personalizado das 8h00 às 22h00, dias úteis, e das 9h00 às 18h00, fins\nde semana e feriados.\nExtrato de conta-cartão nº 20\npágina 5/6\nSAEPK173C\nProcessado por Computador DE - Digital Email\nNB_M150810M03XXG4M_NOR_XXXXXSDX.005XX 193 3\nPag. a Prestações Ref.: 00133092\nTransação: Worten\nData Transação: 15.11.2024\nValor: 349,99\nData Fracionamento: 05.12.2024\nTAN: 9,9000 %\nDetalhe da prestação:\nData do Débito\n08.08.2025\nMatosinhos\nN.º Prestação\nCapital a\nAmortizar\n9/12\n31,99\nCapital em dívida após pagamento da prestação: 129,61\nPag. a Prestações Ref.ª: 00148696\nTransação: HOMA MAIA JARDIM\nData Transação: 28.03.2025\nValor: 480,00\nData Fracionamento: 02.04.2025\nTAN: 9,9000 %\nDetalhe da prestação:\nData do Débito\n08.08.2025\nΜΑΙΑ\nJuros\nImpostos\nTotal Prestação\n1,07\n0,04\n33,10\nN.º Prestação\nCapital a\nAmortizar\nJuros\nImpostos\nTotal Prestação\n5/6\n92,67\n1,54\n0,06\n94,27\nCapital em dívida após pagamento da prestação: 186,15\nPag. a Prestações Ref.ª: 00164300\nTransação: RADIO POPULAR\nData Transação: 07.07.2025\nData Fracionamento: 08.07.2025\nValor: 2.689,92\nTAN: 9,9000 %\nDetalhe da prestação:\nData do Débito\n08.08.2025\nARCOZELO VNG\nN.º Prestação\nCapital a\nAmortizar\nJuros\nImpostos\nTotal Prestação\n2/36\n66,17\n22,17\n0,89\n89,23\nCapital em dívida após pagamento da prestação: 2.687,76\nExtrato de conta-cartão nº 20\npágina 6/6\n"
}